{
  "id": "ann-001",
  "component": "plate",
  "kind": "callout",
  "severity": "warn",
  "feature": "layoutShiftViz",
  "timeRange": {
    "start": 1000,
    "end": 3500
  },
  "outTimeRange": {
    "start": 3200,
    "end": 5700
  },
  "anchor": {
    "selector": "button[data-testid='save']",
    "pageId": "page-main",
    "bbox": {
      "x": 420,
      "y": 180,
      "w": 96,
      "h": 32
    },
    "track": "static",
    "pad": 6,
    "evidenceRef": "event:42"
  },
  "plate": {
    "kicker": "LAYOUT",
    "label": "Save button moved 3px left",
    "measurement": "Δx -3.0px"
  },
  "shape": "rect",
  "lineStyle": "dashed",
  "renderer": "ass",
  "priority": 10,
  "confidence": 0.92,
  "reviewState": "open",
  "label": "Save button moved 3px left"
}
